{
  "control_mode": "thin",
  "control_plane": {
    "path": "/Users/jiangli/总控库/软件开发/.worktrees/aid-client-v1",
    "type": "local-path"
  },
  "experience": {
    "accessibility_standard": "not_applicable",
    "applicability": "confirmed",
    "contract_version": "experience/v2",
    "design_provider": {
      "authority": "non_authoritative_adapter",
      "name": "none"
    },
    "design_required": false,
    "design_root": "",
    "design_status": "not_applicable",
    "privacy_gate": {
      "private_artifacts_upload": "forbidden",
      "training_opt_out_confirmed": false
    },
    "rationale": "Headless Python canary application with no user-facing UI; visual design stages are not applicable.",
    "surface_type": "none",
    "visual_breakpoints": []
  },
  "owners": {
    "data_owner": "@3289937554-cell",
    "default_owner": "@3289937554-cell",
    "platform_owner": "@3289937554-cell",
    "security_owner": "@3289937554-cell"
  },
  "project_id": "project-0007-ai-delivery-canary-app",
  "repo": {
    "default_branch": "chore/ai-delivery-bootstrap",
    "github": {
      "name_with_owner": "3289937554-cell/ai-delivery-canary-app",
      "origin": "https://github.com/3289937554-cell/ai-delivery-canary-app.git"
    },
    "path": "/Users/jiangli/项目库/worktrees/GH-7-bootstrap"
  },
  "schema_version": "ai-delivery-project/v1",
  "template_identity": {
    "control_mode": "thin",
    "control_plane_root": "/Users/jiangli/总控库/软件开发/.worktrees/aid-client-v1",
    "files": [
      {
        "destination": ".github/CODEOWNERS",
        "expected_sha256": "c8326ce6310aec5b5e77b397d99a155356357705365494832545dd90419a1907",
        "kind": "rendered-codeowners",
        "source": "templates/github/CODEOWNERS.example",
        "source_sha256": "b6e339048e5e0afc4bf39905b8ea48e4c49848bca1bf0393eb76ff1cfb3d1d80"
      },
      {
        "destination": ".github/ISSUE_TEMPLATE/ai-delivery.yml",
        "expected_sha256": "023e3fa3fe267b1f549bb7ca16c74b1d0a3e971fea25de38163f41a90d7efdcf",
        "kind": "copy",
        "source": "templates/github/ISSUE_TEMPLATE/ai-delivery.yml",
        "source_sha256": "023e3fa3fe267b1f549bb7ca16c74b1d0a3e971fea25de38163f41a90d7efdcf"
      },
      {
        "destination": ".github/pull_request_template.md",
        "expected_sha256": "ee741a3b2ebc503b924bebdd6721d601359be2269158b382ea7815a60f608bee",
        "kind": "copy",
        "source": "templates/github/pull_request_template.md",
        "source_sha256": "ee741a3b2ebc503b924bebdd6721d601359be2269158b382ea7815a60f608bee"
      },
      {
        "destination": ".github/workflows/ai-delivery-ci.yml",
        "expected_sha256": "0709289cf3f38a774fcf8331e3faee6c0d4e4dfd999f6c8eed2d1556c3c8ce2a",
        "kind": "copy",
        "source": "templates/github/workflows/ai-delivery-ci.yml",
        "source_sha256": "0709289cf3f38a774fcf8331e3faee6c0d4e4dfd999f6c8eed2d1556c3c8ce2a"
      },
      {
        "destination": "scripts/generate_evidence_manifest.py",
        "expected_sha256": "8ff4436fd4138b0dc73b0fc435421badaaa08b731dfea6a5507832ac881cf868",
        "kind": "copy",
        "source": "scripts/generate_evidence_manifest.py",
        "source_sha256": "8ff4436fd4138b0dc73b0fc435421badaaa08b731dfea6a5507832ac881cf868"
      },
      {
        "destination": "scripts/validate_evidence_manifest.py",
        "expected_sha256": "da79bc752549bdabc0a2655352079e75f0ab0e9990be5daf8e56bd9b91dc52d4",
        "kind": "copy",
        "source": "scripts/validate_evidence_manifest.py",
        "source_sha256": "da79bc752549bdabc0a2655352079e75f0ab0e9990be5daf8e56bd9b91dc52d4"
      }
    ],
    "identity_sha256": "baf3c8b4e4f17d74095878160798b35c8faa48df376c6ded9112f2f86842d9ea",
    "installer_version": "ai-delivery-installer/v1",
    "schema_version": "ai-delivery-template-identity/v1"
  },
  "verification": {
    "build": "project adapter selected by .github/workflows/ai-delivery-ci.yml",
    "evidence": "python3 scripts/validate_evidence_manifest.py evidence/GH-<number>/manifest.json --repo-root . --strict",
    "lint": "project adapter selected by .github/workflows/ai-delivery-ci.yml",
    "smoke": "project adapter selected by .github/workflows/ai-delivery-ci.yml",
    "test": "project adapter selected by .github/workflows/ai-delivery-ci.yml",
    "typecheck": "project adapter selected by .github/workflows/ai-delivery-ci.yml"
  },
  "workflow": {
    "branch_pattern": "ai/GH-<number>-<slug>",
    "evidence_manifest": "evidence/GH-<number>/manifest.json",
    "lifecycle": "S0-S10",
    "worktree_pattern": "../worktrees/GH-<number>-<slug>"
  }
}
